Chapter,Clause,Reference,Title,Description,Initial Assessment Points,Evidence/Artifact,Findings,Status
Chapter 1. California Consumer Privacy Act Regulations,Article 8. Training and Record-Keeping,§ 7101,Record-Keeping,Requires maintaining records of consumer requests/responses and timing sufficient to demonstrate compliance; specifies retention periods and safeguards.,"1) Are request logs maintained with timestamps, outcomes, and identity verification steps?
2) Are retention periods defined and enforced for request records?
3) Are access controls and safeguards applied to these records?",Identity verification SOP; Risk-based verification matrix; Authorized agent process; Verification logs,,
Chapter 1. California Consumer Privacy Act Regulations,Article 8. Training and Record-Keeping,§ 7102,Requirements for Businesses Collecting Large Amounts of Personal Information,"Imposes heightened reporting/record‑keeping on businesses processing large volumes of PI/sensitive PI (e.g., public metrics on request handling).","1) Does the business qualify for large‑volume obligations and, if so, publish required metrics?
2) Are internal dashboards and audits in place for volume‑based obligations?
3) Are methodologies for metrics calculation documented?",DSAR metrics report; Record-keeping policy; Audit logs; Annual privacy program report,,
Chapter 1. California Consumer Privacy Act Regulations,Article 9. Investigations and Enforcement,§ 7300,Sworn Complaints Filed with the Agency,"Sets procedures for filing sworn complaints with the CPPA; required content, intake, and processing steps.","1) Are channels to receive/forward CPPA complaints established?
2) Is a protocol in place to respond to Agency inquiries promptly?
3) Are complaint records and correspondence retained?",Data retention schedule; Disposal/destruction certificates; System retention configurations; Retention notice text,,
Chapter 1. California Consumer Privacy Act Regulations,Article 9. Investigations and Enforcement,§ 7301,Investigations,"Describes CPPA investigative powers (requests, subpoenas, interviews), initiation/closure criteria, and confidentiality expectations.","1) Are legal/Privacy teams prepared for data requests, subpoenas, and interviews?
2) Are confidentiality and legal hold procedures defined for investigations?
3) Is there a playbook for responding to CPPA investigations?",General CPPA evidence: privacy notices; DSAR procedures & logs; opt-out/GPC evidence; SPI controls; DPAs; retention & security records,,
Chapter 1. California Consumer Privacy Act Regulations,Article 9. Investigations and Enforcement,§ 7302,Probable Cause Proceedings,"Explains procedures for establishing probable cause of violations, notices to respondents, and response opportunities.","1) Is there a documented response process for probable cause notices?
2) Are responsible owners designated and timelines tracked?
3) Are remediation plans prepared if probable cause is found?",Consumer Privacy Notice; Notice at Collection (web/app/HR/vendor); WCAG conformance evidence; Version control of notices,,
Chapter 1. California Consumer Privacy Act Regulations,Article 9. Investigations and Enforcement,§ 7303,Stipulated Orders,"Provides for settlements/stipulated orders, including potential injunctive relief, remediation, and penalties, and the legal effect of such orders.","1) Are negotiation and approval processes defined for stipulated orders?
2) Are obligations tracked to closure post‑settlement?
3) Are lessons learned integrated into policies/controls?",General CPPA evidence: privacy notices; DSAR procedures & logs; opt-out/GPC evidence; SPI controls; DPAs; retention & security records,,
Chapter 1. California Consumer Privacy Act Regulations,Article 9. Investigations and Enforcement,§ 7304,Agency Audits,"Authorizes CPPA audits, describes triggers/scope, and outlines record‑production and cooperation duties.","1) Is there an audit‑response plan including document production and SME availability?
2) Are systems of record and data maps current to support audits?
3) Are corrective actions from audit findings tracked to completion?",Privacy governance charter; Scope determination memo; Definitions register; Applicability assessment (CCPA/CPRA thresholds),,
Chapter 2. Conflict of Interest,Chapter 2. Conflict of Interest,§ 7500,California Privacy Protection Agency – Conflict-of-Interest Code,"Adopts the CPPA conflict‑of‑interest code, identifying designated positions and disclosure categories to prevent conflicts in Agency decision‑making.","1) For entities interacting with the CPPA, are ethics/compliance procedures aligned to conflict‑of‑interest requirements?
2) Are disclosures and recusals documented when appropriate?
3) Are staff trained on recognizing and escalating potential conflicts?",Consumer Privacy Notice; Notice at Collection (web/app/HR/vendor); WCAG conformance evidence; Version control of notices,,
Chapter 3. Data Broker Registration,Article 1. Annual Registration Fees,§ 7600,Annual Registration Fee,Sets the annual registration fee for data brokers required to register with the CPPA and administrative details for payment/processing.,"1) If the organization is a data broker, is registration current and fee paid?
2) Are registration records retained with confirmation of payment?
3) Is responsibility assigned for annual renewals and updates?",Data retention schedule; Disposal/destruction certificates; System retention configurations; Retention notice text,,